Job_ID,Job_Title,Company,Industry,Location,Experience_Years,Salary_INR,Employment_Type,Company_Size,Education_Required,Hiring_Urgency,Open_Positions,Applicant_Count,Skills,Posted_Date
AIJ101145,NLP Engineer,InnoTech,Healthcare,Remote,2,1605214,Hybrid,Mid-size,Bachelor's,Medium,13,482,"Machine Learning, NLP, PyTorch, Statistics, Tableau",2025-09-09
AIJ101146,AI Researcher,AIWorks,Finance,Noida,5,4763832,Remote,Enterprise,Bachelor's,Low,10,347,"Azure, Excel, NLP, Power BI, Tableau",2025-11-02
AIJ101147,NLP Engineer,InnoTech,EdTech,Hyderabad,9,4396478,Remote,Enterprise,PhD,High,19,413,"Azure, LLMs, Machine Learning, NLP, SQL",2026-02-21
AIJ101148,Computer Vision Engineer,QuantEdge,Healthcare,Remote,4,890675,Remote,Mid-size,Master's,Low,1,263,"Azure, Excel, Machine Learning, NLP, SQL",2025-10-01
AIJ101149,AI Researcher,DataSphere,Retail,Mumbai,1,2032286,Hybrid,Startup,PhD,Low,15,201,"Excel, LLMs, NLP, Python, SQL",2025-12-23
AIJ101150,Prompt Engineer,CloudMind,EdTech,Kolkata,7,1364153,Remote,Startup,Bachelor's,High,8,269,"Excel, LLMs, Machine Learning, Power BI, Python",2026-05-10
AIJ101151,AI Researcher,NextGen AI,Logistics,Kolkata,12,2380674,Hybrid,Enterprise,Master's,Low,11,180,"AWS, Azure, Machine Learning, PyTorch, Statistics",2026-02-23
AIJ101152,Computer Vision Engineer,DataSphere,Finance,Noida,9,4938838,Remote,Enterprise,Master's,Medium,18,313,"Deep Learning, LLMs, PyTorch, Statistics, Tableau",2025-09-21
AIJ101153,Data Scientist,Insight Labs,EdTech,Noida,3,3230233,Remote,Startup,PhD,High,9,160,"Azure, Deep Learning, Excel, Machine Learning, Python",2026-04-27
AIJ101154,NLP Engineer,CloudMind,Finance,Kolkata,0,1995974,Hybrid,Enterprise,Bachelor's,Medium,7,306,"AWS, Deep Learning, Machine Learning, Python, Statistics",2026-01-12
AIJ101155,AI Researcher,DataSphere,EdTech,Pune,4,802275,Hybrid,Enterprise,PhD,High,5,404,"Deep Learning, LLMs, NLP, Python, TensorFlow",2026-03-05
AIJ101156,LLM Engineer,DataSphere,SaaS,Bangalore,10,1788293,Onsite,Enterprise,Master's,Medium,6,429,"Deep Learning, Machine Learning, PyTorch, SQL, Tableau",2026-03-02
AIJ101157,MLOps Engineer,TechNova,Healthcare,Kolkata,9,1640213,Remote,Mid-size,Bachelor's,High,13,286,"Azure, Machine Learning, Power BI, Statistics, Tableau",2025-07-20
AIJ101158,MLOps Engineer,NextGen AI,SaaS,Hyderabad,8,1517260,Hybrid,Mid-size,Bachelor's,Medium,20,313,"Azure, LLMs, Power BI, PyTorch, Statistics",2026-02-15
AIJ101159,AI Engineer,AIWorks,Healthcare,Bangalore,5,3355682,Hybrid,Mid-size,Bachelor's,High,2,167,"Azure, PyTorch, Python, Statistics, Tableau",2025-07-31
AIJ101160,Prompt Engineer,DataSphere,Telecom,Ahmedabad,6,2370759,Hybrid,Startup,Bachelor's,Low,14,476,"AWS, Azure, NLP, Statistics, TensorFlow",2026-04-30
AIJ101161,Computer Vision Engineer,DataSphere,Finance,Bangalore,12,4491926,Remote,Mid-size,Master's,High,6,313,"Excel, NLP, PyTorch, Statistics, TensorFlow",2025-07-31
AIJ101162,AI Engineer,InnoTech,EdTech,Pune,3,3463619,Hybrid,Mid-size,PhD,High,11,105,"Deep Learning, LLMs, NLP, Tableau, TensorFlow",2026-02-10
AIJ101163,Computer Vision Engineer,TechNova,Retail,Kolkata,2,2034079,Remote,Enterprise,Master's,Low,16,449,"Excel, LLMs, NLP, Tableau, TensorFlow",2025-11-26
AIJ101164,Computer Vision Engineer,CloudMind,Finance,Hyderabad,5,1824114,Onsite,Startup,Bachelor's,Medium,15,426,"AWS, Azure, NLP, SQL, TensorFlow",2026-05-26
AIJ101165,Prompt Engineer,InnoTech,Finance,Remote,9,4131383,Hybrid,Startup,Bachelor's,High,13,243,"Excel, LLMs, Power BI, Python, Statistics",2026-04-21
AIJ101166,AI Researcher,QuantEdge,SaaS,Pune,6,2012245,Remote,Startup,PhD,High,1,184,"Excel, LLMs, Power BI, PyTorch, Statistics",2025-09-19
AIJ101167,Data Analyst,QuantEdge,EdTech,Hyderabad,10,849153,Remote,Enterprise,Bachelor's,High,7,302,"Azure, Deep Learning, LLMs, PyTorch, Python",2026-03-30
AIJ101168,MLOps Engineer,AIWorks,EdTech,Chennai,0,1233090,Remote,Mid-size,Master's,High,13,180,"Excel, LLMs, NLP, PyTorch, TensorFlow",2025-07-12
AIJ101169,NLP Engineer,NextGen AI,Telecom,Noida,0,4172632,Onsite,Enterprise,Master's,Medium,19,49,"AWS, Power BI, PyTorch, Python, TensorFlow",2026-01-20
AIJ101170,Machine Learning Engineer,TechNova,Logistics,Bangalore,8,2725956,Remote,Mid-size,Master's,Low,6,192,"AWS, Azure, Machine Learning, Statistics, Tableau",2026-04-13
AIJ101171,Machine Learning Engineer,InnoTech,Logistics,Chennai,3,4928310,Hybrid,Startup,Master's,Low,9,77,"AWS, Azure, Deep Learning, PyTorch, Tableau",2026-05-17
AIJ101172,Data Analyst,DataSphere,Healthcare,Bangalore,9,873995,Remote,Startup,Bachelor's,Low,10,437,"AWS, Azure, Machine Learning, SQL, TensorFlow",2025-10-12
AIJ101173,NLP Engineer,TechNova,Finance,Hyderabad,7,2631454,Onsite,Enterprise,PhD,Medium,5,24,"LLMs, Power BI, PyTorch, Statistics, Tableau",2025-10-04
AIJ101174,AI Researcher,Insight Labs,Telecom,Bangalore,12,2594657,Hybrid,Enterprise,Bachelor's,High,18,423,"Deep Learning, LLMs, NLP, SQL, Statistics",2026-02-16
AIJ101175,Computer Vision Engineer,InnoTech,EdTech,Chennai,11,597266,Hybrid,Mid-size,PhD,Low,11,87,"AWS, Machine Learning, Power BI, PyTorch, TensorFlow",2025-09-26
AIJ101176,AI Researcher,DataSphere,SaaS,Kolkata,5,955611,Hybrid,Enterprise,PhD,Low,9,486,"Azure, Excel, NLP, PyTorch, Python",2025-09-09
AIJ101177,Data Analyst,NextGen AI,Cybersecurity,Remote,14,1302615,Onsite,Enterprise,Bachelor's,High,19,401,"Deep Learning, Excel, LLMs, Power BI, SQL",2026-06-03
AIJ101178,LLM Engineer,CloudMind,SaaS,Noida,7,4726953,Remote,Enterprise,Master's,Medium,19,360,"AWS, Deep Learning, Machine Learning, PyTorch, Statistics",2026-01-03
AIJ101179,Computer Vision Engineer,Insight Labs,SaaS,Bangalore,3,1884471,Hybrid,Startup,Bachelor's,High,10,302,"Azure, Excel, Machine Learning, NLP, Power BI",2025-06-30
AIJ101180,Machine Learning Engineer,AIWorks,Healthcare,Chennai,13,1367260,Onsite,Enterprise,Bachelor's,Medium,8,331,"AWS, Deep Learning, Excel, Tableau, TensorFlow",2025-12-19
AIJ101181,Computer Vision Engineer,QuantEdge,Finance,Noida,5,993670,Hybrid,Startup,PhD,Low,12,93,"AWS, Excel, Power BI, SQL, Statistics",2025-10-24
AIJ101182,Computer Vision Engineer,TechNova,Finance,Kolkata,0,1714188,Onsite,Enterprise,Master's,Low,16,52,"AWS, Excel, PyTorch, Python, Tableau",2026-03-19
AIJ101183,Machine Learning Engineer,QuantEdge,SaaS,Bangalore,8,4019555,Onsite,Startup,Master's,Low,5,102,"AWS, Azure, Power BI, Tableau, TensorFlow",2026-01-27
AIJ101184,AI Engineer,AIWorks,Logistics,Mumbai,5,657338,Hybrid,Enterprise,Master's,Medium,20,22,"Excel, NLP, Power BI, PyTorch, SQL",2025-09-14
AIJ101185,Prompt Engineer,CloudMind,EdTech,Chennai,15,3075629,Hybrid,Startup,Bachelor's,Low,5,85,"Azure, Excel, NLP, Statistics, Tableau",2026-04-15
AIJ101186,Data Scientist,DataSphere,Telecom,Bangalore,5,1891123,Onsite,Enterprise,Master's,High,16,373,"Azure, Machine Learning, PyTorch, SQL, Tableau",2025-09-26
AIJ101187,MLOps Engineer,AIWorks,EdTech,Delhi,10,3653223,Remote,Enterprise,Bachelor's,Low,17,439,"Azure, Deep Learning, Excel, Power BI, Tableau",2026-02-10
AIJ101188,Prompt Engineer,TechNova,EdTech,Noida,1,3558180,Hybrid,Mid-size,Master's,Medium,11,89,"Excel, Machine Learning, NLP, Power BI, Statistics",2025-08-28
AIJ101189,Data Scientist,Insight Labs,EdTech,Mumbai,0,2313100,Remote,Mid-size,Bachelor's,Low,14,42,"AWS, Azure, Deep Learning, LLMs, PyTorch",2025-07-07
AIJ101190,Data Scientist,DataSphere,Retail,Bangalore,6,1460434,Hybrid,Enterprise,PhD,High,7,341,"LLMs, NLP, SQL, Statistics, TensorFlow",2025-08-29
AIJ101191,Data Scientist,Insight Labs,EdTech,Remote,4,3509528,Remote,Enterprise,Master's,Medium,2,468,"Excel, Python, SQL, Tableau, TensorFlow",2026-02-13
AIJ101192,AI Engineer,NextGen AI,Telecom,Chennai,13,1348538,Hybrid,Enterprise,Master's,High,16,404,"Azure, Deep Learning, Excel, LLMs, TensorFlow",2025-12-14
AIJ101193,AI Researcher,TechNova,Finance,Ahmedabad,5,3805211,Onsite,Enterprise,Bachelor's,High,15,374,"Excel, LLMs, Machine Learning, PyTorch, Python",2026-02-15
AIJ101194,Data Scientist,QuantEdge,Logistics,Ahmedabad,15,4013655,Onsite,Startup,Master's,Low,20,474,"AWS, Azure, LLMs, NLP, Statistics",2025-07-28
AIJ101195,LLM Engineer,DataSphere,EdTech,Pune,13,1362136,Onsite,Mid-size,Bachelor's,Medium,5,319,"Azure, PyTorch, Python, Tableau, TensorFlow",2025-08-17
AIJ101196,AI Engineer,CloudMind,SaaS,Delhi,4,4158142,Hybrid,Enterprise,Master's,Low,7,121,"AWS, LLMs, NLP, PyTorch, SQL",2025-07-10
AIJ101197,Prompt Engineer,Insight Labs,SaaS,Hyderabad,5,1220123,Onsite,Mid-size,Master's,Low,3,223,"AWS, Excel, Power BI, SQL, Tableau",2025-10-19
AIJ101198,NLP Engineer,TechNova,Retail,Noida,0,3731781,Hybrid,Enterprise,Master's,Low,17,187,"AWS, Excel, PyTorch, SQL, Statistics",2025-09-04
AIJ101199,LLM Engineer,DataSphere,Finance,Kolkata,9,953972,Onsite,Mid-size,Master's,High,18,342,"AWS, Azure, LLMs, Statistics, Tableau",2026-05-24
AIJ101200,Prompt Engineer,InnoTech,Logistics,Kolkata,12,4832178,Remote,Startup,PhD,High,9,195,"Deep Learning, LLMs, Power BI, Python, TensorFlow",2026-04-04
AIJ101201,LLM Engineer,QuantEdge,Cybersecurity,Pune,10,3986933,Onsite,Enterprise,Master's,Medium,15,487,"Excel, PyTorch, Python, SQL, Tableau",2026-03-12
AIJ101202,LLM Engineer,NextGen AI,SaaS,Chennai,7,1282152,Onsite,Startup,Master's,Low,11,227,"AWS, Azure, LLMs, Python, TensorFlow",2025-06-13
AIJ101203,AI Engineer,InnoTech,EdTech,Noida,0,2706119,Hybrid,Enterprise,PhD,Low,2,90,"Deep Learning, Excel, Machine Learning, SQL, TensorFlow",2025-12-11
AIJ101204,Machine Learning Engineer,QuantEdge,EdTech,Hyderabad,8,861152,Remote,Startup,PhD,Medium,15,305,"Excel, LLMs, NLP, PyTorch, SQL",2025-06-13
AIJ101205,Data Analyst,NextGen AI,Finance,Chennai,5,3984149,Remote,Startup,Bachelor's,Medium,19,417,"Excel, LLMs, PyTorch, SQL, TensorFlow",2026-02-27
AIJ101206,Prompt Engineer,Insight Labs,Cybersecurity,Bangalore,2,2277233,Hybrid,Startup,Bachelor's,High,6,410,"LLMs, Power BI, Python, SQL, TensorFlow",2025-11-17
AIJ101207,MLOps Engineer,Insight Labs,Telecom,Bangalore,4,3845213,Remote,Mid-size,PhD,Low,6,341,"AWS, Excel, Machine Learning, SQL, Tableau",2025-08-12
AIJ101208,AI Engineer,TechNova,Retail,Chennai,2,4855809,Hybrid,Enterprise,PhD,Medium,7,120,"Azure, LLMs, Machine Learning, PyTorch, TensorFlow",2025-09-27
AIJ101209,LLM Engineer,QuantEdge,Cybersecurity,Hyderabad,4,4280214,Remote,Startup,Bachelor's,Medium,1,468,"Azure, Deep Learning, NLP, Power BI, PyTorch",2025-09-28
AIJ101210,AI Engineer,QuantEdge,Telecom,Chennai,10,658894,Remote,Startup,PhD,Medium,6,426,"AWS, Azure, Deep Learning, Statistics, TensorFlow",2026-05-25
AIJ101211,Data Analyst,InnoTech,Healthcare,Chennai,14,1397720,Hybrid,Startup,Bachelor's,Low,7,65,"AWS, Deep Learning, Excel, NLP, Power BI",2025-07-01
AIJ101212,AI Researcher,Insight Labs,Healthcare,Delhi,3,1593285,Hybrid,Startup,Bachelor's,Low,14,172,"LLMs, PyTorch, Python, Statistics, TensorFlow",2026-05-03
AIJ101213,Data Analyst,NextGen AI,Healthcare,Hyderabad,10,3383157,Remote,Startup,PhD,Medium,3,246,"AWS, LLMs, NLP, Statistics, TensorFlow",2026-06-03
AIJ101214,NLP Engineer,NextGen AI,SaaS,Delhi,2,1884330,Onsite,Enterprise,PhD,Low,1,225,"AWS, Deep Learning, Power BI, Python, TensorFlow",2026-04-29
AIJ101215,Computer Vision Engineer,InnoTech,Cybersecurity,Pune,6,3038059,Remote,Enterprise,Master's,Low,16,277,"Deep Learning, Excel, LLMs, SQL, TensorFlow",2025-09-01
AIJ101216,NLP Engineer,InnoTech,Retail,Kolkata,9,1172044,Onsite,Startup,PhD,Medium,2,351,"Azure, Excel, Statistics, Tableau, TensorFlow",2026-04-19
AIJ101217,AI Engineer,CloudMind,Cybersecurity,Delhi,9,1695974,Onsite,Mid-size,Bachelor's,Medium,10,50,"AWS, Excel, Machine Learning, SQL, Statistics",2025-10-21
AIJ101218,Data Analyst,InnoTech,Finance,Remote,5,3684062,Onsite,Enterprise,Master's,High,10,79,"LLMs, NLP, Power BI, Statistics, TensorFlow",2026-04-14
AIJ101219,Computer Vision Engineer,CloudMind,Cybersecurity,Bangalore,3,1918864,Hybrid,Enterprise,Bachelor's,Low,19,208,"Azure, Excel, Machine Learning, Power BI, Tableau",2025-08-01
AIJ101220,Machine Learning Engineer,InnoTech,Logistics,Hyderabad,14,1456231,Remote,Mid-size,Master's,Medium,6,301,"AWS, Machine Learning, PyTorch, Python, SQL",2026-06-05
AIJ101221,Machine Learning Engineer,NextGen AI,Healthcare,Noida,4,4804833,Remote,Enterprise,Master's,High,15,433,"AWS, Excel, PyTorch, SQL, TensorFlow",2026-05-02
AIJ101222,LLM Engineer,TechNova,SaaS,Delhi,13,4810924,Remote,Enterprise,Master's,Medium,2,463,"Azure, Power BI, PyTorch, Python, Tableau",2026-03-10
AIJ101223,Prompt Engineer,QuantEdge,Healthcare,Remote,8,4788889,Remote,Mid-size,PhD,High,8,100,"AWS, Excel, LLMs, NLP, Power BI",2026-04-10
AIJ101224,Data Analyst,QuantEdge,Retail,Mumbai,4,4126557,Hybrid,Enterprise,Bachelor's,Low,13,293,"AWS, Deep Learning, LLMs, Machine Learning, PyTorch",2026-01-06
AIJ101225,Machine Learning Engineer,InnoTech,Cybersecurity,Noida,4,744840,Remote,Enterprise,Master's,Medium,3,77,"Deep Learning, Excel, Machine Learning, PyTorch, SQL",2025-08-20
AIJ101226,AI Researcher,QuantEdge,Logistics,Hyderabad,12,1206233,Remote,Mid-size,Master's,High,17,216,"Deep Learning, LLMs, SQL, Statistics, Tableau",2025-11-25
AIJ101227,Data Scientist,QuantEdge,SaaS,Kolkata,15,842831,Onsite,Mid-size,PhD,High,15,362,"AWS, Excel, Python, SQL, TensorFlow",2025-08-11
AIJ101228,Data Scientist,QuantEdge,Telecom,Mumbai,8,4871824,Hybrid,Enterprise,PhD,Medium,20,150,"Deep Learning, Machine Learning, PyTorch, Python, Statistics",2026-04-03
AIJ101229,AI Researcher,AIWorks,Retail,Delhi,6,4764395,Onsite,Enterprise,PhD,Medium,9,185,"Excel, LLMs, PyTorch, SQL, Tableau",2025-08-03
AIJ101230,AI Engineer,Insight Labs,Logistics,Delhi,15,3055698,Remote,Mid-size,Master's,Low,11,390,"Azure, LLMs, Machine Learning, PyTorch, Tableau",2025-08-03
AIJ101231,Machine Learning Engineer,QuantEdge,Cybersecurity,Pune,8,2793418,Hybrid,Startup,Bachelor's,Medium,14,351,"Azure, Deep Learning, NLP, PyTorch, TensorFlow",2026-05-28
AIJ101232,Machine Learning Engineer,TechNova,Cybersecurity,Ahmedabad,11,4725028,Onsite,Startup,Bachelor's,Medium,12,409,"NLP, Power BI, Python, SQL, TensorFlow",2025-12-30
AIJ101233,Machine Learning Engineer,TechNova,Retail,Noida,9,2477711,Onsite,Enterprise,Bachelor's,High,17,466,"AWS, Azure, Deep Learning, LLMs, Machine Learning",2025-12-27
AIJ101234,MLOps Engineer,TechNova,Healthcare,Kolkata,14,1730879,Hybrid,Startup,Bachelor's,Medium,11,174,"AWS, Deep Learning, NLP, PyTorch, SQL",2025-12-22
AIJ101235,AI Engineer,AIWorks,Finance,Mumbai,14,2035480,Remote,Startup,Master's,Low,14,209,"Deep Learning, Excel, LLMs, Statistics, Tableau",2025-12-17
AIJ101236,AI Engineer,NextGen AI,Finance,Mumbai,13,2055832,Hybrid,Mid-size,Bachelor's,Medium,4,456,"AWS, Azure, Power BI, Statistics, Tableau",2025-07-02
AIJ101237,AI Researcher,AIWorks,SaaS,Hyderabad,0,856201,Hybrid,Mid-size,PhD,Medium,7,59,"AWS, Deep Learning, Excel, Python, SQL",2025-07-13
AIJ101238,Prompt Engineer,QuantEdge,Logistics,Hyderabad,10,3185957,Remote,Enterprise,PhD,High,18,335,"Azure, NLP, Python, Tableau, TensorFlow",2025-11-27
AIJ101239,AI Engineer,CloudMind,Telecom,Ahmedabad,10,2129430,Hybrid,Startup,PhD,Medium,16,90,"Machine Learning, Power BI, Python, SQL, Tableau",2025-12-02
AIJ101240,Computer Vision Engineer,NextGen AI,Cybersecurity,Ahmedabad,15,3491889,Onsite,Enterprise,Bachelor's,Medium,4,170,"Azure, Deep Learning, Python, SQL, Tableau",2026-04-06
AIJ101241,Computer Vision Engineer,InnoTech,Cybersecurity,Pune,11,2038026,Remote,Startup,Master's,Low,5,283,"AWS, Azure, Excel, PyTorch, Statistics",2026-05-30
AIJ101242,AI Engineer,QuantEdge,Retail,Hyderabad,2,1856191,Onsite,Enterprise,Bachelor's,Medium,19,462,"AWS, Azure, Python, Statistics, Tableau",2026-04-12
AIJ101243,Machine Learning Engineer,Insight Labs,SaaS,Mumbai,2,4332458,Hybrid,Startup,Master's,High,11,321,"LLMs, NLP, Power BI, Python, Statistics",2025-12-14
AIJ101244,MLOps Engineer,QuantEdge,Retail,Kolkata,7,3962341,Onsite,Mid-size,Bachelor's,Medium,20,368,"Excel, Machine Learning, Power BI, PyTorch, TensorFlow",2025-08-16
AIJ101245,MLOps Engineer,DataSphere,Cybersecurity,Chennai,15,2199010,Remote,Enterprise,Master's,High,10,372,"AWS, Excel, NLP, PyTorch, TensorFlow",2025-11-11
AIJ101246,Computer Vision Engineer,CloudMind,Finance,Bangalore,13,4188150,Hybrid,Mid-size,Bachelor's,Medium,8,270,"Azure, Deep Learning, LLMs, NLP, Power BI",2025-12-05
AIJ101247,AI Engineer,QuantEdge,EdTech,Hyderabad,6,814190,Remote,Startup,PhD,Medium,16,286,"Deep Learning, Excel, NLP, Power BI, PyTorch",2025-06-20
AIJ101248,AI Engineer,TechNova,Healthcare,Chennai,8,980820,Remote,Mid-size,PhD,Medium,2,219,"Excel, Power BI, PyTorch, SQL, TensorFlow",2026-02-19
AIJ101249,AI Researcher,AIWorks,Retail,Chennai,14,4406377,Remote,Startup,Bachelor's,Low,17,261,"LLMs, NLP, Power BI, SQL, Tableau",2026-06-06
AIJ101250,NLP Engineer,NextGen AI,Telecom,Kolkata,8,4696893,Onsite,Startup,PhD,Low,11,316,"AWS, PyTorch, Python, SQL, Statistics",2025-09-13
AIJ101251,AI Researcher,QuantEdge,EdTech,Ahmedabad,7,777218,Remote,Mid-size,Master's,Low,5,34,"AWS, NLP, PyTorch, Statistics, Tableau",2026-05-02
AIJ101252,Data Analyst,CloudMind,Telecom,Mumbai,2,2282534,Onsite,Startup,Bachelor's,High,15,258,"AWS, Excel, PyTorch, SQL, TensorFlow",2025-10-29
AIJ101253,MLOps Engineer,QuantEdge,Retail,Kolkata,1,600280,Remote,Startup,Bachelor's,Medium,2,18,"Azure, LLMs, Python, SQL, Tableau",2026-01-27
AIJ101254,MLOps Engineer,InnoTech,Logistics,Kolkata,0,3414162,Hybrid,Startup,Bachelor's,Medium,1,227,"Deep Learning, LLMs, NLP, Statistics, TensorFlow",2026-03-09
AIJ101255,Machine Learning Engineer,CloudMind,EdTech,Chennai,14,2531436,Remote,Enterprise,Bachelor's,Low,8,286,"Excel, NLP, PyTorch, Python, Statistics",2026-01-07
AIJ101256,AI Engineer,TechNova,Telecom,Kolkata,5,3283538,Remote,Enterprise,PhD,Low,12,498,"Deep Learning, LLMs, Power BI, Tableau, TensorFlow",2025-12-23
AIJ101257,Computer Vision Engineer,AIWorks,Cybersecurity,Bangalore,0,1322411,Onsite,Mid-size,PhD,Low,18,108,"AWS, Excel, Machine Learning, Power BI, Python",2025-08-13
AIJ101258,AI Engineer,InnoTech,Cybersecurity,Mumbai,3,4599065,Remote,Startup,Master's,Medium,6,171,"AWS, LLMs, Machine Learning, Python, SQL",2026-05-06
AIJ101259,AI Engineer,DataSphere,Healthcare,Hyderabad,12,3826508,Hybrid,Mid-size,Master's,Low,1,302,"AWS, Power BI, PyTorch, Python, SQL",2026-03-24
AIJ101260,Data Analyst,DataSphere,EdTech,Pune,0,1023469,Onsite,Mid-size,PhD,Medium,3,110,"Excel, LLMs, SQL, Statistics, Tableau",2025-12-10
AIJ101261,NLP Engineer,InnoTech,Logistics,Bangalore,13,2278467,Hybrid,Mid-size,PhD,Low,8,500,"AWS, Deep Learning, Machine Learning, NLP, Statistics",2025-11-04
AIJ101262,Computer Vision Engineer,QuantEdge,SaaS,Hyderabad,5,1208198,Remote,Startup,PhD,Low,4,351,"Deep Learning, Excel, Machine Learning, NLP, Statistics",2025-07-31
AIJ101263,AI Researcher,NextGen AI,EdTech,Hyderabad,10,2590939,Onsite,Enterprise,PhD,Low,20,245,"Power BI, Python, Statistics, Tableau, TensorFlow",2026-01-19
AIJ101264,NLP Engineer,TechNova,SaaS,Remote,2,1992397,Remote,Startup,Bachelor's,Medium,8,440,"AWS, Deep Learning, Machine Learning, Power BI, Python",2026-03-24
AIJ101265,NLP Engineer,AIWorks,Telecom,Pune,15,1942143,Remote,Startup,PhD,High,1,288,"AWS, Deep Learning, Power BI, PyTorch, Statistics",2026-05-03
AIJ101266,Machine Learning Engineer,QuantEdge,Cybersecurity,Hyderabad,11,4133063,Remote,Enterprise,Bachelor's,Low,9,391,"Deep Learning, Excel, NLP, Python, Tableau",2025-11-25
AIJ101267,Prompt Engineer,AIWorks,Finance,Mumbai,2,1547920,Hybrid,Mid-size,Bachelor's,Medium,1,174,"Deep Learning, Excel, LLMs, SQL, Statistics",2025-09-22
AIJ101268,Data Scientist,Insight Labs,Cybersecurity,Hyderabad,13,1896654,Remote,Startup,Master's,High,18,339,"Deep Learning, NLP, PyTorch, Python, TensorFlow",2025-08-01
AIJ101269,NLP Engineer,NextGen AI,Healthcare,Noida,10,521722,Onsite,Enterprise,Master's,Low,3,246,"Deep Learning, NLP, Power BI, PyTorch, Tableau",2025-07-21
AIJ101270,AI Researcher,QuantEdge,Cybersecurity,Bangalore,12,3404368,Onsite,Mid-size,Master's,High,8,466,"AWS, Azure, Power BI, SQL, Statistics",2025-09-01
AIJ101271,Machine Learning Engineer,Insight Labs,Telecom,Remote,0,4137648,Remote,Mid-size,PhD,Medium,14,349,"LLMs, NLP, PyTorch, Python, SQL",2026-01-10
AIJ101272,Data Scientist,Insight Labs,Logistics,Chennai,10,4070927,Onsite,Enterprise,Bachelor's,Medium,20,456,"Azure, Deep Learning, Excel, LLMs, Tableau",2026-02-22
AIJ101273,Data Scientist,DataSphere,SaaS,Delhi,15,4730926,Remote,Startup,Master's,High,8,189,"Excel, Machine Learning, Python, SQL, Tableau",2026-04-28
AIJ101274,MLOps Engineer,QuantEdge,Retail,Ahmedabad,14,586293,Hybrid,Startup,PhD,Low,3,24,"AWS, Deep Learning, Excel, LLMs, Machine Learning",2026-05-01
AIJ101275,MLOps Engineer,QuantEdge,EdTech,Chennai,6,3422942,Onsite,Enterprise,Bachelor's,Low,17,201,"Azure, Excel, Machine Learning, Power BI, SQL",2025-10-24
AIJ101276,MLOps Engineer,DataSphere,Cybersecurity,Hyderabad,14,2933000,Onsite,Enterprise,PhD,High,15,14,"AWS, Deep Learning, Excel, Power BI, Statistics",2026-03-01
AIJ101277,AI Researcher,InnoTech,Logistics,Pune,6,1602183,Onsite,Enterprise,Bachelor's,High,6,297,"Excel, LLMs, Machine Learning, PyTorch, Tableau",2025-08-24
AIJ101278,Prompt Engineer,NextGen AI,Retail,Delhi,3,4167480,Onsite,Enterprise,Master's,High,5,144,"AWS, LLMs, PyTorch, Statistics, Tableau",2025-12-10
AIJ101279,AI Researcher,NextGen AI,EdTech,Ahmedabad,7,1435895,Onsite,Startup,Bachelor's,Medium,11,357,"Azure, Excel, Machine Learning, NLP, TensorFlow",2026-05-28
AIJ101280,Data Analyst,Insight Labs,Healthcare,Remote,7,3722157,Onsite,Mid-size,Bachelor's,Medium,15,373,"Azure, Deep Learning, NLP, Power BI, Tableau",2025-11-07
AIJ101281,LLM Engineer,CloudMind,Retail,Delhi,6,2132558,Onsite,Startup,PhD,High,2,212,"NLP, Power BI, PyTorch, SQL, TensorFlow",2026-03-17
AIJ101282,Machine Learning Engineer,CloudMind,Telecom,Mumbai,0,2546251,Hybrid,Startup,Master's,Low,2,499,"AWS, Azure, Excel, Machine Learning, NLP",2026-03-13
AIJ101283,MLOps Engineer,DataSphere,Telecom,Hyderabad,13,3201936,Remote,Startup,Bachelor's,High,8,165,"AWS, Azure, NLP, Power BI, Tableau",2026-04-06
AIJ101284,MLOps Engineer,DataSphere,EdTech,Chennai,14,4997848,Hybrid,Enterprise,Master's,Low,3,140,"Azure, Deep Learning, Excel, Python, SQL",2026-01-15
AIJ101285,LLM Engineer,TechNova,SaaS,Kolkata,9,2990266,Remote,Mid-size,PhD,Low,6,112,"Machine Learning, NLP, Power BI, Tableau, TensorFlow",2026-03-12
AIJ101286,MLOps Engineer,QuantEdge,EdTech,Kolkata,2,1222348,Remote,Mid-size,PhD,High,10,34,"Deep Learning, NLP, Power BI, Tableau, TensorFlow",2026-05-25
AIJ101287,AI Engineer,AIWorks,Telecom,Chennai,15,2406346,Onsite,Startup,Master's,Medium,19,263,"Azure, LLMs, Python, SQL, TensorFlow",2025-11-23
AIJ101288,NLP Engineer,CloudMind,EdTech,Chennai,1,3304240,Remote,Enterprise,Master's,High,11,310,"AWS, Azure, Power BI, Statistics, Tableau",2025-08-25
AIJ101289,Prompt Engineer,DataSphere,Healthcare,Bangalore,0,2573335,Onsite,Startup,Bachelor's,High,5,432,"Azure, Deep Learning, Machine Learning, NLP, SQL",2025-10-28
AIJ101290,MLOps Engineer,DataSphere,Healthcare,Ahmedabad,0,2061312,Onsite,Startup,PhD,High,13,357,"Azure, Deep Learning, Machine Learning, NLP, Python",2026-01-04
AIJ101291,AI Researcher,AIWorks,Healthcare,Delhi,5,861012,Onsite,Enterprise,Master's,High,12,396,"Azure, Deep Learning, NLP, Power BI, Python",2026-01-17
AIJ101292,LLM Engineer,AIWorks,Finance,Mumbai,15,3546459,Remote,Enterprise,Bachelor's,High,18,314,"Azure, Machine Learning, Power BI, SQL, Tableau",2025-10-15
AIJ101293,AI Researcher,Insight Labs,SaaS,Noida,0,3622579,Remote,Startup,Bachelor's,Low,18,252,"Deep Learning, Machine Learning, SQL, Tableau, TensorFlow",2026-02-04
AIJ101294,Data Scientist,TechNova,SaaS,Ahmedabad,14,4993456,Onsite,Enterprise,Master's,Low,7,12,"AWS, Machine Learning, PyTorch, Python, TensorFlow",2025-08-22
AIJ101295,AI Researcher,AIWorks,Healthcare,Noida,0,2933230,Remote,Mid-size,Bachelor's,High,17,118,"LLMs, Machine Learning, Python, SQL, Statistics",2025-08-30
AIJ101296,AI Researcher,DataSphere,Retail,Kolkata,13,4658530,Hybrid,Mid-size,Master's,High,7,226,"Machine Learning, NLP, Power BI, PyTorch, Tableau",2026-03-22
AIJ101297,LLM Engineer,Insight Labs,Cybersecurity,Noida,15,1685432,Onsite,Startup,PhD,Medium,3,219,"AWS, NLP, Power BI, PyTorch, Python",2026-01-31
AIJ101298,Prompt Engineer,Insight Labs,Finance,Hyderabad,5,2015921,Remote,Enterprise,Master's,High,20,331,"Azure, Excel, Machine Learning, NLP, TensorFlow",2026-04-02
AIJ101299,NLP Engineer,QuantEdge,Retail,Noida,15,1915380,Hybrid,Enterprise,Master's,Low,7,312,"Azure, LLMs, Machine Learning, NLP, Tableau",2025-12-21
AIJ101300,LLM Engineer,CloudMind,EdTech,Delhi,10,4340641,Hybrid,Mid-size,Master's,Medium,16,415,"Azure, NLP, Statistics, Tableau, TensorFlow",2026-03-09
AIJ101301,Data Analyst,CloudMind,Cybersecurity,Chennai,10,2891977,Remote,Mid-size,Master's,Medium,14,10,"NLP, Power BI, PyTorch, Python, SQL",2025-08-13
AIJ101302,Data Analyst,InnoTech,Retail,Noida,4,1331143,Onsite,Enterprise,Bachelor's,Medium,19,35,"AWS, Excel, Machine Learning, Python, TensorFlow",2025-11-08
AIJ101303,Data Analyst,InnoTech,Logistics,Hyderabad,1,2552477,Remote,Enterprise,Bachelor's,Low,13,489,"AWS, Azure, Excel, Python, Statistics",2026-03-13
AIJ101304,Data Scientist,Insight Labs,Healthcare,Chennai,14,1791962,Onsite,Mid-size,Master's,High,15,286,"AWS, LLMs, PyTorch, Python, TensorFlow",2026-03-10
AIJ101305,Computer Vision Engineer,QuantEdge,EdTech,Kolkata,7,3095858,Remote,Enterprise,Master's,Medium,4,482,"Excel, LLMs, Machine Learning, Statistics, TensorFlow",2025-08-18
AIJ101306,Data Analyst,AIWorks,Cybersecurity,Kolkata,15,4262813,Remote,Mid-size,PhD,Low,17,85,"Deep Learning, NLP, SQL, Tableau, TensorFlow",2025-07-18
AIJ101307,AI Engineer,NextGen AI,Cybersecurity,Hyderabad,6,617752,Remote,Startup,PhD,Low,7,296,"AWS, Deep Learning, Python, Tableau, TensorFlow",2025-10-02
AIJ101308,Computer Vision Engineer,TechNova,Telecom,Kolkata,6,4518135,Hybrid,Mid-size,Master's,Medium,1,95,"Excel, LLMs, Python, Statistics, Tableau",2025-09-14
