Job_ID,Job_Title,Company,Industry,Location,Experience_Years,Salary_INR,Employment_Type,Company_Size,Education_Required,Hiring_Urgency,Open_Positions,Applicant_Count,Skills,Posted_Date
AIJ100655,Machine Learning Engineer,AIWorks,Finance,Chennai,15,3494928,Remote,Startup,Master's,Medium,19,445,"Excel, NLP, PyTorch, Python, SQL",2025-11-02
AIJ100656,AI Researcher,InnoTech,Finance,Chennai,14,1285765,Onsite,Startup,Bachelor's,Low,7,116,"AWS, Azure, Deep Learning, Excel, Python",2025-10-20
AIJ100657,Computer Vision Engineer,DataSphere,EdTech,Ahmedabad,3,731383,Remote,Startup,Master's,High,9,414,"AWS, Azure, Excel, PyTorch, Statistics",2026-05-19
AIJ100658,NLP Engineer,DataSphere,Telecom,Chennai,5,4442680,Onsite,Mid-size,Master's,Medium,19,26,"AWS, Azure, Power BI, Statistics, TensorFlow",2025-07-18
AIJ100659,LLM Engineer,Insight Labs,Finance,Noida,4,1952352,Remote,Startup,Bachelor's,Low,6,104,"Deep Learning, Power BI, PyTorch, Python, Tableau",2025-09-12
AIJ100660,AI Researcher,DataSphere,EdTech,Bangalore,0,3283763,Remote,Mid-size,PhD,Medium,16,339,"AWS, LLMs, Power BI, SQL, Statistics",2026-02-18
AIJ100661,AI Engineer,NextGen AI,SaaS,Hyderabad,5,1901655,Hybrid,Mid-size,Master's,Low,6,372,"LLMs, Machine Learning, Python, Statistics, TensorFlow",2025-10-23
AIJ100662,Data Analyst,DataSphere,Finance,Noida,2,2548858,Hybrid,Enterprise,Bachelor's,Low,18,121,"AWS, Deep Learning, NLP, Power BI, Statistics",2025-08-19
AIJ100663,MLOps Engineer,Insight Labs,Retail,Pune,5,685838,Hybrid,Enterprise,Bachelor's,Medium,4,296,"NLP, Power BI, Python, Statistics, Tableau",2026-04-22
AIJ100664,Data Analyst,InnoTech,Finance,Mumbai,4,2921462,Hybrid,Startup,Bachelor's,Medium,9,199,"Deep Learning, LLMs, Power BI, Statistics, TensorFlow",2025-11-12
AIJ100665,Data Scientist,DataSphere,Retail,Remote,1,1907285,Onsite,Startup,PhD,Low,12,347,"AWS, Excel, Power BI, Python, TensorFlow",2026-02-01
AIJ100666,NLP Engineer,TechNova,Logistics,Noida,11,2444875,Onsite,Enterprise,Bachelor's,Medium,6,328,"AWS, Excel, LLMs, Machine Learning, Python",2026-05-13
AIJ100667,Prompt Engineer,AIWorks,Healthcare,Chennai,14,1526309,Onsite,Enterprise,Bachelor's,High,2,452,"Azure, Deep Learning, PyTorch, Python, Statistics",2026-05-16
AIJ100668,Data Analyst,NextGen AI,SaaS,Kolkata,8,1966656,Hybrid,Startup,Bachelor's,Medium,15,232,"Machine Learning, PyTorch, Python, Statistics, Tableau",2025-11-17
AIJ100669,Computer Vision Engineer,NextGen AI,Finance,Bangalore,3,1759399,Onsite,Enterprise,Master's,Low,6,204,"AWS, NLP, PyTorch, Statistics, Tableau",2025-11-21
AIJ100670,Prompt Engineer,CloudMind,SaaS,Kolkata,5,595746,Onsite,Mid-size,Bachelor's,High,8,192,"AWS, Excel, Machine Learning, SQL, TensorFlow",2025-06-25
AIJ100671,Data Analyst,InnoTech,Cybersecurity,Ahmedabad,2,3833041,Hybrid,Enterprise,Master's,Medium,13,302,"LLMs, Power BI, Python, Tableau, TensorFlow",2025-06-29
AIJ100672,LLM Engineer,AIWorks,EdTech,Chennai,1,1010751,Remote,Mid-size,Master's,Medium,10,333,"Azure, Excel, LLMs, Tableau, TensorFlow",2026-05-18
AIJ100673,AI Engineer,Insight Labs,SaaS,Mumbai,15,4523033,Onsite,Enterprise,PhD,Medium,11,480,"AWS, Excel, Python, Tableau, TensorFlow",2026-05-22
AIJ100674,MLOps Engineer,TechNova,Cybersecurity,Ahmedabad,13,4270426,Onsite,Mid-size,Master's,Low,15,128,"AWS, Excel, NLP, Python, TensorFlow",2025-11-01
AIJ100675,Data Scientist,InnoTech,Telecom,Noida,12,4289671,Hybrid,Mid-size,PhD,Medium,14,239,"Deep Learning, Power BI, PyTorch, Statistics, TensorFlow",2026-04-11
AIJ100676,Computer Vision Engineer,Insight Labs,Healthcare,Chennai,3,2060474,Remote,Startup,Master's,Medium,5,323,"AWS, Machine Learning, Power BI, PyTorch, TensorFlow",2026-03-05
AIJ100677,LLM Engineer,QuantEdge,Healthcare,Noida,11,3069757,Remote,Startup,Bachelor's,High,3,180,"AWS, Deep Learning, Power BI, PyTorch, Statistics",2025-10-23
AIJ100678,Machine Learning Engineer,NextGen AI,EdTech,Hyderabad,0,4468363,Hybrid,Startup,Bachelor's,Medium,9,289,"Azure, Machine Learning, PyTorch, Python, Tableau",2025-07-04
AIJ100679,AI Researcher,NextGen AI,Finance,Mumbai,15,2948838,Onsite,Startup,Master's,High,6,376,"Deep Learning, LLMs, PyTorch, Tableau, TensorFlow",2026-01-18
AIJ100680,Computer Vision Engineer,Insight Labs,Logistics,Mumbai,1,3155448,Onsite,Enterprise,Bachelor's,Medium,18,128,"Azure, Deep Learning, NLP, PyTorch, Python",2025-07-25
AIJ100681,Data Analyst,TechNova,EdTech,Remote,12,3660114,Hybrid,Startup,Bachelor's,Low,8,485,"AWS, Azure, LLMs, Power BI, Python",2025-11-20
AIJ100682,Machine Learning Engineer,CloudMind,Retail,Mumbai,14,3458186,Remote,Enterprise,Master's,Medium,2,295,"AWS, Excel, Machine Learning, Power BI, SQL",2025-12-10
AIJ100683,LLM Engineer,TechNova,EdTech,Chennai,12,1226210,Hybrid,Enterprise,Bachelor's,High,16,231,"LLMs, Machine Learning, NLP, Statistics, Tableau",2025-06-23
AIJ100684,Data Analyst,Insight Labs,Cybersecurity,Noida,2,2279181,Onsite,Mid-size,PhD,High,8,477,"Azure, PyTorch, Statistics, Tableau, TensorFlow",2025-08-24
AIJ100685,Data Analyst,NextGen AI,Logistics,Remote,4,4700725,Remote,Startup,Master's,High,18,423,"Excel, Machine Learning, Power BI, PyTorch, Statistics",2025-09-23
AIJ100686,Machine Learning Engineer,QuantEdge,EdTech,Hyderabad,15,4950120,Hybrid,Startup,Master's,Low,15,358,"Excel, LLMs, Machine Learning, NLP, Statistics",2026-02-22
AIJ100687,Machine Learning Engineer,CloudMind,Healthcare,Delhi,5,610410,Remote,Enterprise,PhD,High,7,203,"Deep Learning, SQL, Statistics, Tableau, TensorFlow",2025-08-05
AIJ100688,Data Analyst,NextGen AI,Finance,Kolkata,5,3591588,Remote,Enterprise,PhD,Medium,9,28,"Azure, Deep Learning, Power BI, PyTorch, Python",2026-01-17
AIJ100689,Data Scientist,CloudMind,Telecom,Hyderabad,9,529686,Hybrid,Enterprise,Bachelor's,Medium,20,194,"LLMs, Machine Learning, Power BI, SQL, Statistics",2025-10-20
AIJ100690,AI Researcher,TechNova,Finance,Hyderabad,0,3253037,Hybrid,Mid-size,Bachelor's,Low,5,407,"AWS, Machine Learning, Power BI, SQL, Tableau",2025-12-23
AIJ100691,AI Researcher,Insight Labs,SaaS,Mumbai,7,3845040,Hybrid,Mid-size,Master's,Medium,3,177,"AWS, Azure, Deep Learning, LLMs, Python",2026-04-22
AIJ100692,Data Analyst,Insight Labs,Finance,Pune,1,4066938,Hybrid,Enterprise,Master's,Medium,2,290,"AWS, NLP, Python, SQL, Tableau",2026-01-21
AIJ100693,LLM Engineer,NextGen AI,Cybersecurity,Remote,6,3634625,Remote,Startup,Bachelor's,High,12,264,"AWS, Azure, NLP, Python, SQL",2026-04-13
AIJ100694,NLP Engineer,QuantEdge,EdTech,Ahmedabad,8,4320730,Hybrid,Startup,Master's,Medium,15,234,"AWS, LLMs, NLP, Python, Tableau",2025-08-25
AIJ100695,MLOps Engineer,InnoTech,Telecom,Pune,0,3575061,Onsite,Startup,PhD,Low,15,320,"Deep Learning, Excel, LLMs, Power BI, TensorFlow",2025-09-06
AIJ100696,AI Researcher,QuantEdge,SaaS,Ahmedabad,4,832895,Hybrid,Enterprise,Bachelor's,Medium,18,456,"AWS, Azure, Power BI, PyTorch, Python",2025-12-01
AIJ100697,Machine Learning Engineer,CloudMind,EdTech,Kolkata,15,3447066,Onsite,Mid-size,PhD,Low,13,164,"Excel, NLP, Power BI, Python, Tableau",2025-08-30
AIJ100698,Machine Learning Engineer,TechNova,Logistics,Pune,3,2563903,Onsite,Mid-size,PhD,Medium,12,113,"AWS, Azure, Deep Learning, Excel, TensorFlow",2025-10-02
AIJ100699,AI Engineer,AIWorks,Retail,Remote,4,1618197,Remote,Mid-size,PhD,Low,18,485,"AWS, NLP, SQL, Tableau, TensorFlow",2026-03-21
AIJ100700,Computer Vision Engineer,QuantEdge,Telecom,Remote,5,613384,Onsite,Startup,Master's,High,9,413,"AWS, Deep Learning, Power BI, PyTorch, TensorFlow",2025-08-21
AIJ100701,Machine Learning Engineer,QuantEdge,Finance,Delhi,11,1233823,Onsite,Mid-size,PhD,Medium,8,73,"Excel, NLP, Power BI, PyTorch, Python",2025-12-04
AIJ100702,NLP Engineer,DataSphere,Cybersecurity,Ahmedabad,1,3459506,Onsite,Mid-size,Bachelor's,Low,1,441,"AWS, Excel, Python, SQL, TensorFlow",2025-10-09
AIJ100703,MLOps Engineer,Insight Labs,Telecom,Delhi,5,677898,Hybrid,Mid-size,Bachelor's,High,13,100,"Machine Learning, NLP, Python, Statistics, Tableau",2026-01-25
AIJ100704,LLM Engineer,AIWorks,Healthcare,Kolkata,10,4367518,Onsite,Mid-size,PhD,High,4,104,"Excel, Machine Learning, NLP, Statistics, Tableau",2025-11-27
AIJ100705,Data Scientist,QuantEdge,Logistics,Chennai,10,1875022,Onsite,Enterprise,Master's,Low,10,329,"AWS, Azure, LLMs, Machine Learning, Python",2026-05-09
AIJ100706,AI Engineer,InnoTech,Healthcare,Delhi,8,4552781,Remote,Startup,Bachelor's,High,4,25,"Deep Learning, LLMs, NLP, Python, TensorFlow",2025-11-17
AIJ100707,AI Researcher,NextGen AI,Finance,Pune,8,1589504,Remote,Enterprise,PhD,Medium,11,239,"Azure, Power BI, SQL, Statistics, Tableau",2026-05-10
AIJ100708,LLM Engineer,DataSphere,EdTech,Delhi,11,4616820,Onsite,Startup,Bachelor's,Low,12,308,"AWS, Azure, Excel, PyTorch, Tableau",2025-07-09
AIJ100709,AI Engineer,InnoTech,Retail,Bangalore,14,3008532,Remote,Mid-size,PhD,High,11,399,"Deep Learning, Power BI, SQL, Statistics, Tableau",2025-11-01
AIJ100710,Computer Vision Engineer,QuantEdge,Healthcare,Ahmedabad,11,4044590,Hybrid,Startup,Master's,Medium,10,335,"LLMs, Power BI, SQL, Statistics, TensorFlow",2025-11-28
AIJ100711,NLP Engineer,AIWorks,Retail,Noida,9,1964467,Onsite,Mid-size,Master's,Low,16,402,"AWS, Power BI, SQL, Statistics, Tableau",2025-07-16
AIJ100712,LLM Engineer,QuantEdge,Finance,Noida,0,4416476,Onsite,Enterprise,Master's,High,19,53,"Azure, Deep Learning, Machine Learning, Power BI, Statistics",2026-04-25
AIJ100713,Machine Learning Engineer,QuantEdge,Healthcare,Delhi,0,4927612,Hybrid,Startup,Master's,Medium,8,490,"LLMs, NLP, Power BI, Tableau, TensorFlow",2026-04-15
AIJ100714,Data Scientist,QuantEdge,SaaS,Remote,9,4329721,Onsite,Mid-size,Master's,Medium,4,450,"Excel, LLMs, Power BI, Python, Tableau",2025-10-28
AIJ100715,Prompt Engineer,InnoTech,EdTech,Chennai,8,1073528,Hybrid,Startup,Bachelor's,Low,1,277,"Azure, Excel, NLP, PyTorch, Statistics",2026-01-02
AIJ100716,AI Engineer,AIWorks,Cybersecurity,Chennai,3,2697895,Remote,Mid-size,Bachelor's,Low,7,50,"Azure, LLMs, NLP, PyTorch, Statistics",2025-12-21
AIJ100717,Computer Vision Engineer,InnoTech,Telecom,Noida,15,4850120,Remote,Startup,PhD,Medium,6,250,"AWS, LLMs, Machine Learning, Power BI, TensorFlow",2025-09-04
AIJ100718,AI Engineer,AIWorks,Retail,Bangalore,8,4983590,Hybrid,Enterprise,Bachelor's,Medium,7,152,"LLMs, NLP, Python, SQL, TensorFlow",2025-07-01
AIJ100719,Computer Vision Engineer,InnoTech,Cybersecurity,Mumbai,9,1534389,Onsite,Startup,Master's,Medium,4,340,"AWS, Azure, Machine Learning, Tableau, TensorFlow",2026-02-20
AIJ100720,Data Analyst,AIWorks,Telecom,Kolkata,14,4256478,Hybrid,Mid-size,Master's,Low,9,267,"AWS, Excel, NLP, Tableau, TensorFlow",2026-03-26
AIJ100721,AI Engineer,TechNova,Retail,Ahmedabad,0,954451,Hybrid,Mid-size,Bachelor's,High,5,173,"Azure, Excel, LLMs, Python, TensorFlow",2025-11-20
AIJ100722,Data Scientist,AIWorks,Healthcare,Kolkata,10,4017890,Onsite,Startup,Bachelor's,Medium,8,268,"AWS, Python, Statistics, Tableau, TensorFlow",2026-01-19
AIJ100723,Machine Learning Engineer,Insight Labs,Healthcare,Hyderabad,5,3483392,Remote,Mid-size,Bachelor's,Low,2,258,"Azure, Excel, Machine Learning, SQL, TensorFlow",2026-01-18
AIJ100724,Data Scientist,CloudMind,Retail,Chennai,5,4317848,Remote,Mid-size,PhD,Low,17,213,"Azure, LLMs, Statistics, Tableau, TensorFlow",2026-03-21
AIJ100725,LLM Engineer,CloudMind,Finance,Noida,9,3722706,Hybrid,Mid-size,Master's,Medium,1,221,"Azure, Machine Learning, NLP, Power BI, TensorFlow",2025-08-13
AIJ100726,Machine Learning Engineer,DataSphere,Retail,Bangalore,13,2767382,Hybrid,Enterprise,Bachelor's,High,5,30,"AWS, Azure, Excel, Power BI, SQL",2025-12-17
AIJ100727,Prompt Engineer,InnoTech,Healthcare,Hyderabad,6,4478167,Remote,Mid-size,PhD,Low,4,414,"Excel, Machine Learning, Power BI, Python, SQL",2026-05-08
AIJ100728,AI Engineer,QuantEdge,Telecom,Hyderabad,14,2591311,Onsite,Startup,Master's,Medium,2,398,"AWS, LLMs, Machine Learning, Power BI, PyTorch",2025-11-10
AIJ100729,Computer Vision Engineer,TechNova,SaaS,Mumbai,15,2425333,Hybrid,Startup,Bachelor's,Low,18,24,"Deep Learning, Excel, LLMs, PyTorch, TensorFlow",2026-03-06
AIJ100730,Data Scientist,AIWorks,Retail,Pune,11,2073542,Remote,Enterprise,PhD,Low,11,352,"Azure, Deep Learning, NLP, Python, TensorFlow",2025-07-11
AIJ100731,NLP Engineer,NextGen AI,SaaS,Hyderabad,9,4402768,Onsite,Startup,Bachelor's,Medium,2,493,"Deep Learning, LLMs, SQL, Statistics, TensorFlow",2025-10-29
AIJ100732,Computer Vision Engineer,AIWorks,Telecom,Bangalore,1,2006634,Remote,Mid-size,Bachelor's,Medium,1,70,"Azure, Excel, SQL, Statistics, TensorFlow",2025-07-04
AIJ100733,Data Scientist,NextGen AI,Finance,Noida,2,530952,Remote,Mid-size,Bachelor's,High,18,152,"AWS, Deep Learning, LLMs, Machine Learning, PyTorch",2025-11-28
AIJ100734,Computer Vision Engineer,InnoTech,Cybersecurity,Chennai,2,4112183,Onsite,Enterprise,Master's,Medium,5,106,"Deep Learning, NLP, Power BI, SQL, TensorFlow",2026-01-27
AIJ100735,AI Researcher,QuantEdge,Cybersecurity,Hyderabad,10,4586200,Remote,Enterprise,Bachelor's,Medium,10,461,"AWS, Azure, Machine Learning, NLP, Tableau",2025-07-30
AIJ100736,Data Scientist,InnoTech,Cybersecurity,Hyderabad,5,1535533,Onsite,Mid-size,PhD,Low,5,35,"Deep Learning, Excel, Machine Learning, Python, Statistics",2025-08-11
AIJ100737,Prompt Engineer,NextGen AI,Logistics,Chennai,4,789009,Remote,Enterprise,Master's,Low,15,405,"Excel, Machine Learning, NLP, Power BI, Python",2026-02-21
AIJ100738,AI Researcher,InnoTech,Telecom,Remote,8,4368214,Remote,Startup,Bachelor's,Medium,20,170,"Excel, Machine Learning, Power BI, Python, Statistics",2025-07-27
AIJ100739,Machine Learning Engineer,NextGen AI,SaaS,Mumbai,2,2867520,Onsite,Enterprise,Master's,Medium,9,40,"Excel, LLMs, PyTorch, Python, Tableau",2026-05-29
AIJ100740,Computer Vision Engineer,Insight Labs,Healthcare,Chennai,9,3924191,Hybrid,Startup,PhD,High,2,205,"Deep Learning, Excel, Machine Learning, NLP, PyTorch",2026-03-29
AIJ100741,Computer Vision Engineer,InnoTech,Telecom,Remote,15,1923165,Remote,Startup,Bachelor's,High,16,246,"Azure, Deep Learning, Machine Learning, Statistics, TensorFlow",2025-11-09
AIJ100742,Data Analyst,TechNova,Retail,Chennai,4,3090917,Onsite,Enterprise,Bachelor's,High,19,495,"Excel, NLP, PyTorch, Python, Tableau",2025-08-08
AIJ100743,Data Scientist,TechNova,Finance,Mumbai,6,3158393,Remote,Startup,Master's,Medium,3,162,"AWS, LLMs, Machine Learning, PyTorch, Python",2025-09-16
AIJ100744,Prompt Engineer,QuantEdge,Healthcare,Chennai,13,4822135,Onsite,Mid-size,PhD,Medium,19,387,"Azure, Excel, LLMs, PyTorch, Tableau",2025-09-03
AIJ100745,Prompt Engineer,CloudMind,Logistics,Pune,5,559041,Onsite,Mid-size,Master's,Medium,13,480,"Azure, Deep Learning, LLMs, Statistics, TensorFlow",2026-04-05
AIJ100746,MLOps Engineer,AIWorks,EdTech,Kolkata,11,1301445,Onsite,Enterprise,PhD,Low,6,77,"Azure, Excel, NLP, Statistics, TensorFlow",2025-09-27
AIJ100747,AI Researcher,DataSphere,Healthcare,Ahmedabad,14,1854060,Hybrid,Enterprise,PhD,Medium,12,363,"Azure, Deep Learning, Python, SQL, Tableau",2026-01-11
AIJ100748,AI Engineer,Insight Labs,Telecom,Kolkata,11,1293920,Onsite,Startup,PhD,Medium,20,328,"Excel, LLMs, PyTorch, Python, TensorFlow",2025-06-28
AIJ100749,Machine Learning Engineer,NextGen AI,SaaS,Remote,6,1452195,Onsite,Mid-size,Bachelor's,Low,13,77,"Machine Learning, Power BI, PyTorch, Tableau, TensorFlow",2026-04-23
AIJ100750,MLOps Engineer,TechNova,EdTech,Pune,3,1013209,Remote,Enterprise,Bachelor's,Low,17,338,"Azure, Machine Learning, NLP, Tableau, TensorFlow",2026-05-16
AIJ100751,Machine Learning Engineer,CloudMind,SaaS,Ahmedabad,13,4913924,Remote,Startup,Bachelor's,Low,8,458,"Azure, LLMs, NLP, SQL, Tableau",2026-03-18
AIJ100752,Data Scientist,TechNova,Finance,Mumbai,2,1254362,Remote,Startup,Master's,Low,14,128,"AWS, Power BI, Python, SQL, Statistics",2026-01-20
AIJ100753,MLOps Engineer,AIWorks,Logistics,Noida,9,4512805,Hybrid,Mid-size,Master's,Medium,20,422,"AWS, Azure, LLMs, Python, TensorFlow",2025-06-20
AIJ100754,Data Analyst,CloudMind,SaaS,Mumbai,2,1081116,Onsite,Startup,Master's,Medium,13,277,"Deep Learning, Excel, NLP, Power BI, Python",2025-08-07
AIJ100755,AI Engineer,TechNova,Logistics,Hyderabad,13,3454099,Onsite,Mid-size,Master's,Medium,16,132,"NLP, PyTorch, SQL, Statistics, TensorFlow",2025-10-10
AIJ100756,Data Analyst,TechNova,Logistics,Bangalore,1,2825375,Onsite,Startup,PhD,Low,16,144,"Excel, NLP, Power BI, Python, Tableau",2026-02-09
AIJ100757,LLM Engineer,Insight Labs,EdTech,Bangalore,8,2943842,Remote,Enterprise,Bachelor's,Low,11,369,"Azure, LLMs, NLP, Statistics, TensorFlow",2025-08-08
AIJ100758,MLOps Engineer,NextGen AI,SaaS,Hyderabad,3,2794945,Hybrid,Startup,Bachelor's,Low,18,447,"Azure, Deep Learning, LLMs, Machine Learning, PyTorch",2025-06-25
AIJ100759,Computer Vision Engineer,AIWorks,Finance,Ahmedabad,15,1665126,Remote,Startup,Bachelor's,Low,9,310,"Deep Learning, LLMs, Machine Learning, Power BI, Tableau",2025-09-07
AIJ100760,Data Scientist,DataSphere,Healthcare,Noida,15,3564885,Hybrid,Startup,PhD,High,16,192,"LLMs, Power BI, PyTorch, Python, Statistics",2025-10-15
AIJ100761,Computer Vision Engineer,Insight Labs,Cybersecurity,Bangalore,9,1452172,Hybrid,Enterprise,Bachelor's,Medium,12,359,"Deep Learning, Excel, Power BI, PyTorch, TensorFlow",2025-07-11
AIJ100762,AI Engineer,NextGen AI,Logistics,Pune,1,3049613,Onsite,Mid-size,PhD,Low,14,304,"Excel, LLMs, Python, SQL, TensorFlow",2026-05-10
AIJ100763,NLP Engineer,DataSphere,SaaS,Remote,2,2284409,Hybrid,Mid-size,Bachelor's,High,10,426,"Deep Learning, LLMs, PyTorch, Tableau, TensorFlow",2025-11-16
AIJ100764,LLM Engineer,CloudMind,Retail,Mumbai,2,2401686,Onsite,Mid-size,Master's,High,7,311,"Azure, NLP, Power BI, PyTorch, Python",2025-07-15
AIJ100765,LLM Engineer,InnoTech,SaaS,Chennai,7,3217748,Hybrid,Startup,Master's,Medium,17,151,"Machine Learning, NLP, PyTorch, SQL, Statistics",2025-12-31
AIJ100766,AI Researcher,NextGen AI,EdTech,Kolkata,11,958961,Remote,Startup,Master's,Medium,10,324,"Azure, Machine Learning, NLP, Statistics, Tableau",2025-06-29
AIJ100767,Data Analyst,AIWorks,EdTech,Noida,5,895183,Onsite,Startup,PhD,Medium,3,32,"AWS, Excel, LLMs, PyTorch, Tableau",2026-02-05
AIJ100768,Data Analyst,CloudMind,Logistics,Remote,15,1364534,Hybrid,Enterprise,Master's,Low,3,364,"Machine Learning, NLP, PyTorch, Statistics, Tableau",2026-02-04
AIJ100769,AI Engineer,TechNova,Telecom,Hyderabad,7,3992156,Onsite,Enterprise,Bachelor's,Medium,1,41,"Azure, Machine Learning, Power BI, SQL, TensorFlow",2025-11-09
AIJ100770,Data Scientist,CloudMind,Telecom,Mumbai,15,1389541,Hybrid,Mid-size,PhD,Medium,17,41,"Excel, LLMs, Power BI, Python, SQL",2025-08-06
AIJ100771,Computer Vision Engineer,AIWorks,EdTech,Noida,11,1936698,Onsite,Enterprise,PhD,Medium,17,351,"AWS, Azure, Excel, NLP, Statistics",2026-02-11
AIJ100772,NLP Engineer,DataSphere,Telecom,Ahmedabad,0,2249649,Remote,Startup,PhD,Medium,19,474,"Azure, Excel, LLMs, PyTorch, TensorFlow",2025-08-12
AIJ100773,Data Scientist,NextGen AI,EdTech,Delhi,5,3443848,Remote,Enterprise,PhD,High,12,404,"Azure, Deep Learning, Python, SQL, Tableau",2026-03-17
AIJ100774,Data Analyst,CloudMind,Retail,Chennai,9,4258977,Onsite,Enterprise,Bachelor's,Medium,12,443,"Excel, NLP, Power BI, Python, Statistics",2026-01-09
AIJ100775,MLOps Engineer,CloudMind,Cybersecurity,Ahmedabad,4,4239349,Remote,Mid-size,PhD,High,20,170,"PyTorch, Python, Statistics, Tableau, TensorFlow",2026-03-07
AIJ100776,NLP Engineer,NextGen AI,Telecom,Hyderabad,6,721623,Hybrid,Startup,PhD,Medium,16,42,"Azure, Machine Learning, PyTorch, SQL, Statistics",2026-05-26
AIJ100777,Data Analyst,QuantEdge,Healthcare,Kolkata,4,3513211,Onsite,Enterprise,Bachelor's,Medium,15,69,"AWS, LLMs, Python, SQL, Statistics",2026-01-21
AIJ100778,Data Scientist,QuantEdge,SaaS,Delhi,3,725078,Hybrid,Startup,Master's,Low,10,336,"AWS, Azure, Power BI, SQL, TensorFlow",2025-10-02
AIJ100779,NLP Engineer,CloudMind,Finance,Delhi,6,2515378,Remote,Startup,PhD,Low,14,102,"Deep Learning, Python, SQL, Statistics, TensorFlow",2025-11-15
AIJ100780,MLOps Engineer,DataSphere,Retail,Chennai,4,3244327,Onsite,Mid-size,Bachelor's,Low,8,352,"LLMs, Power BI, Python, SQL, Tableau",2026-01-16
AIJ100781,NLP Engineer,InnoTech,Telecom,Bangalore,15,4757699,Onsite,Enterprise,Bachelor's,Medium,16,267,"Excel, LLMs, Power BI, PyTorch, Python",2026-05-10
AIJ100782,Data Analyst,CloudMind,SaaS,Chennai,0,4883666,Remote,Enterprise,Master's,High,7,193,"AWS, LLMs, NLP, SQL, Statistics",2025-08-02
AIJ100783,Data Scientist,DataSphere,EdTech,Hyderabad,13,1594491,Remote,Startup,Master's,Low,7,205,"AWS, Deep Learning, Power BI, SQL, Statistics",2025-09-02
AIJ100784,Prompt Engineer,InnoTech,Cybersecurity,Mumbai,1,4921322,Onsite,Mid-size,Bachelor's,Medium,7,447,"LLMs, NLP, PyTorch, Python, Statistics",2026-03-09
AIJ100785,Data Scientist,DataSphere,SaaS,Pune,5,3371081,Onsite,Enterprise,Master's,Low,10,246,"PyTorch, SQL, Statistics, Tableau, TensorFlow",2026-03-26
AIJ100786,NLP Engineer,DataSphere,Cybersecurity,Ahmedabad,6,4769301,Remote,Enterprise,Bachelor's,Medium,17,92,"AWS, Excel, Machine Learning, Python, Tableau",2025-12-12
AIJ100787,Machine Learning Engineer,CloudMind,Telecom,Noida,12,4056308,Remote,Startup,Master's,Medium,2,297,"Azure, Machine Learning, NLP, Power BI, Tableau",2026-06-07
AIJ100788,LLM Engineer,Insight Labs,EdTech,Chennai,8,3080409,Remote,Startup,Master's,Medium,5,379,"Deep Learning, Power BI, PyTorch, Python, Tableau",2026-01-11
AIJ100789,Computer Vision Engineer,QuantEdge,SaaS,Chennai,12,3925988,Remote,Mid-size,Master's,Medium,3,306,"Excel, Machine Learning, PyTorch, Statistics, TensorFlow",2026-05-21
AIJ100790,NLP Engineer,TechNova,Healthcare,Delhi,9,3097651,Onsite,Mid-size,PhD,Medium,7,278,"Power BI, PyTorch, Python, Statistics, Tableau",2025-08-22
AIJ100791,LLM Engineer,TechNova,SaaS,Ahmedabad,5,4640001,Onsite,Startup,PhD,Medium,8,59,"Machine Learning, Power BI, SQL, Statistics, Tableau",2025-12-21
AIJ100792,AI Researcher,QuantEdge,Cybersecurity,Pune,7,839723,Onsite,Startup,PhD,Low,4,147,"Power BI, PyTorch, Statistics, Tableau, TensorFlow",2025-09-03
AIJ100793,Computer Vision Engineer,TechNova,EdTech,Chennai,8,1834301,Onsite,Startup,PhD,Medium,17,248,"Azure, LLMs, PyTorch, Python, SQL",2026-05-04
AIJ100794,Computer Vision Engineer,DataSphere,Telecom,Kolkata,0,1702489,Hybrid,Startup,Master's,High,1,176,"Excel, LLMs, Machine Learning, Python, Tableau",2025-07-24
AIJ100795,AI Engineer,Insight Labs,Finance,Hyderabad,3,3671953,Hybrid,Startup,PhD,Medium,13,443,"AWS, Deep Learning, Power BI, SQL, Statistics",2025-09-29
AIJ100796,AI Researcher,DataSphere,EdTech,Remote,9,4526299,Onsite,Startup,PhD,High,3,244,"Azure, LLMs, Machine Learning, SQL, Statistics",2025-08-14
AIJ100797,AI Engineer,QuantEdge,Healthcare,Mumbai,9,1124128,Hybrid,Enterprise,Bachelor's,Low,2,422,"Azure, Excel, Machine Learning, Statistics, TensorFlow",2025-06-16
AIJ100798,Prompt Engineer,Insight Labs,Telecom,Bangalore,5,2939765,Hybrid,Mid-size,Master's,Low,6,224,"NLP, Power BI, SQL, Statistics, Tableau",2026-02-28
AIJ100799,MLOps Engineer,TechNova,EdTech,Remote,12,2004060,Remote,Enterprise,Master's,High,15,286,"AWS, Azure, Deep Learning, Excel, Tableau",2026-01-25
AIJ100800,Computer Vision Engineer,AIWorks,Finance,Pune,4,3930462,Hybrid,Enterprise,Master's,Low,11,379,"AWS, Deep Learning, Machine Learning, Power BI, Tableau",2026-02-09
AIJ100801,LLM Engineer,TechNova,EdTech,Mumbai,10,1980791,Onsite,Mid-size,Bachelor's,Medium,19,232,"AWS, Deep Learning, PyTorch, Statistics, TensorFlow",2025-09-03
AIJ100802,AI Researcher,InnoTech,EdTech,Chennai,15,3514186,Onsite,Enterprise,PhD,Medium,18,471,"Deep Learning, Machine Learning, Power BI, Tableau, TensorFlow",2026-01-29
AIJ100803,Prompt Engineer,Insight Labs,EdTech,Ahmedabad,11,561342,Hybrid,Enterprise,PhD,Low,16,204,"Deep Learning, Excel, PyTorch, Tableau, TensorFlow",2025-09-03
AIJ100804,AI Researcher,AIWorks,Retail,Remote,5,1363191,Remote,Startup,PhD,High,20,134,"AWS, Machine Learning, Power BI, Python, Statistics",2026-01-23
AIJ100805,AI Researcher,AIWorks,Finance,Mumbai,8,4131990,Onsite,Enterprise,PhD,Medium,12,487,"AWS, Deep Learning, LLMs, Machine Learning, PyTorch",2026-05-12
AIJ100806,NLP Engineer,InnoTech,SaaS,Hyderabad,0,1311419,Hybrid,Enterprise,Bachelor's,Low,19,36,"Deep Learning, LLMs, NLP, Statistics, TensorFlow",2026-06-09
AIJ100807,MLOps Engineer,Insight Labs,Healthcare,Mumbai,9,746536,Onsite,Startup,Master's,Low,13,478,"Azure, Excel, NLP, SQL, TensorFlow",2025-07-09
AIJ100808,Data Scientist,QuantEdge,Logistics,Bangalore,14,541232,Onsite,Enterprise,Bachelor's,Medium,2,462,"AWS, Azure, Power BI, Tableau, TensorFlow",2025-09-16
AIJ100809,NLP Engineer,NextGen AI,EdTech,Mumbai,3,3524569,Onsite,Enterprise,Master's,High,16,399,"AWS, Azure, PyTorch, SQL, Tableau",2026-01-02
AIJ100810,Data Analyst,CloudMind,Telecom,Kolkata,11,4912963,Remote,Enterprise,Master's,Low,19,135,"Power BI, PyTorch, Python, Statistics, TensorFlow",2025-09-16
AIJ100811,NLP Engineer,AIWorks,EdTech,Chennai,4,2708415,Hybrid,Enterprise,Bachelor's,High,20,468,"AWS, Machine Learning, NLP, Statistics, TensorFlow",2026-05-29
AIJ100812,LLM Engineer,QuantEdge,Cybersecurity,Pune,13,4256878,Hybrid,Startup,Bachelor's,Low,11,194,"AWS, Deep Learning, LLMs, Machine Learning, Tableau",2026-01-22
AIJ100813,NLP Engineer,TechNova,Cybersecurity,Chennai,1,2108057,Remote,Startup,Master's,High,12,155,"AWS, Excel, Machine Learning, NLP, TensorFlow",2026-06-04
AIJ100814,Data Scientist,NextGen AI,Cybersecurity,Chennai,9,3149446,Hybrid,Mid-size,PhD,Medium,14,22,"AWS, Excel, NLP, Power BI, Tableau",2025-06-14
AIJ100815,MLOps Engineer,TechNova,Finance,Noida,3,4087877,Onsite,Mid-size,Bachelor's,Medium,15,403,"Excel, NLP, Power BI, SQL, TensorFlow",2026-02-25
AIJ100816,Machine Learning Engineer,DataSphere,SaaS,Mumbai,3,1905348,Onsite,Enterprise,Master's,Medium,6,161,"Machine Learning, Power BI, Python, Statistics, TensorFlow",2025-07-14
AIJ100817,NLP Engineer,Insight Labs,EdTech,Delhi,0,3015142,Remote,Startup,Master's,Medium,16,426,"AWS, Deep Learning, Machine Learning, SQL, Statistics",2025-12-15
